StartDate,EndDate,Status,IPAddress,Progress,Duration (in seconds),Finished,RecordedDate,ResponseId,RecipientLastName,RecipientFirstName,RecipientEmail,ExternalReference,LocationLatitude,LocationLongitude,DistributionChannel,UserLanguage,Q4,Q15,Q11,Q12,Q13,Q17,Q14,Q24_First Click,Q24_Last Click,Q24_Page Submit,Q24_Click Count,Q25_1,Q26_1,Q27_1,Q28,Q29,Q30,Q31,Q32,Q105_First Click,Q105_Last Click,Q105_Page Submit,Q105_Click Count,Q106_1,Q107_1,Q108_1,Q109,Q110,Q111,Q112,Q113,Q186_First Click,Q186_Last Click,Q186_Page Submit,Q186_Click Count,Q187_1,Q188_1,Q189_1,Q190,Q191,Q192,Q193,Q194,Q267_First Click,Q267_Last Click,Q267_Page Submit,Q267_Click Count,Q268_1,Q269_1,Q270_1,Q271,Q272,Q273,Q274,Q275,Q348_First Click,Q348_Last Click,Q348_Page Submit,Q348_Click Count,Q349_1,Q350_1,Q351_1,Q352,Q353,Q354,Q355,Q356,Q51_First Click,Q51_Last Click,Q51_Page Submit,Q51_Click Count,Q52_1,Q53_1,Q54_1,Q55,Q56,Q57,Q58,Q59,Q132_First Click,Q132_Last Click,Q132_Page Submit,Q132_Click Count,Q133_1,Q134_1,Q135_1,Q136,Q137,Q138,Q139,Q140,Q213_First Click,Q213_Last Click,Q213_Page Submit,Q213_Click Count,Q214_1,Q215_1,Q216_1,Q217,Q218,Q219,Q220,Q221,Q294_First Click,Q294_Last Click,Q294_Page Submit,Q294_Click Count,Q295_1,Q296_1,Q297_1,Q298,Q299,Q300,Q301,Q302,Q375_First Click,Q375_Last Click,Q375_Page Submit,Q375_Click Count,Q376_1,Q377_1,Q378_1,Q379,Q380,Q381,Q382,Q383,Q78_First Click,Q78_Last Click,Q78_Page Submit,Q78_Click Count,Q79_1,Q80_1,Q81_1,Q82,Q83,Q84,Q85,Q86,Q159_First Click,Q159_Last Click,Q159_Page Submit,Q159_Click Count,Q160_1,Q161_1,Q162_1,Q163,Q164,Q165,Q166,Q167,Q240_First Click,Q240_Last Click,Q240_Page Submit,Q240_Click Count,Q241_1,Q242_1,Q243_1,Q244,Q245,Q246,Q247,Q248,Q321_First Click,Q321_Last Click,Q321_Page Submit,Q321_Click Count,Q322_1,Q323_1,Q324_1,Q325,Q326,Q327,Q328,Q329,Q402_First Click,Q402_Last Click,Q402_Page Submit,Q402_Click Count,Q403_1,Q404_1,Q405_1,Q406,Q407,Q408,Q409,Q410,Q33_First Click,Q33_Last Click,Q33_Page Submit,Q33_Click Count,Q34_1,Q35_1,Q36_1,Q37,Q38,Q39,Q40,Q41,Q114_First Click,Q114_Last Click,Q114_Page Submit,Q114_Click Count,Q115_1,Q116_1,Q117_1,Q118,Q119,Q120,Q121,Q122,Q195_First Click,Q195_Last Click,Q195_Page Submit,Q195_Click Count,Q196_1,Q197_1,Q198_1,Q199,Q200,Q201,Q202,Q203,Q276_First Click,Q276_Last Click,Q276_Page Submit,Q276_Click Count,Q277_1,Q278_1,Q279_1,Q280,Q281,Q282,Q283,Q284,Q357_First Click,Q357_Last Click,Q357_Page Submit,Q357_Click Count,Q358_1,Q359_1,Q360_1,Q361,Q362,Q363,Q364,Q365,Q60_First Click,Q60_Last Click,Q60_Page Submit,Q60_Click Count,Q61_1,Q62_1,Q63_1,Q64,Q65,Q66,Q67,Q68,Q141_First Click,Q141_Last Click,Q141_Page Submit,Q141_Click Count,Q142_1,Q143_1,Q144_1,Q145,Q146,Q147,Q148,Q149,Q222_First Click,Q222_Last Click,Q222_Page Submit,Q222_Click Count,Q223_1,Q224_1,Q225_1,Q226,Q227,Q228,Q229,Q230,Q303_First Click,Q303_Last Click,Q303_Page Submit,Q303_Click Count,Q304_1,Q305_1,Q306_1,Q307,Q308,Q309,Q310,Q311,Q384_First Click,Q384_Last Click,Q384_Page Submit,Q384_Click Count,Q385_1,Q386_1,Q387_1,Q388,Q389,Q390,Q391,Q392,Q87_First Click,Q87_Last Click,Q87_Page Submit,Q87_Click Count,Q88_1,Q89_1,Q90_1,Q91,Q92,Q93,Q94,Q95,Q168_First Click,Q168_Last Click,Q168_Page Submit,Q168_Click Count,Q169_1,Q170_1,Q171_1,Q172,Q173,Q174,Q175,Q176,Q249_First Click,Q249_Last Click,Q249_Page Submit,Q249_Click Count,Q250_1,Q251_1,Q252_1,Q253,Q254,Q255,Q256,Q257,Q330_First Click,Q330_Last Click,Q330_Page Submit,Q330_Click Count,Q331_1,Q332_1,Q333_1,Q334,Q335,Q336,Q337,Q338,Q411_First Click,Q411_Last Click,Q411_Page Submit,Q411_Click Count,Q412_1,Q413_1,Q414_1,Q415,Q416,Q417,Q418,Q419,Q42_First Click,Q42_Last Click,Q42_Page Submit,Q42_Click Count,Q43_1,Q44_1,Q45_1,Q46,Q47,Q48,Q49,Q50,Q123_First Click,Q123_Last Click,Q123_Page Submit,Q123_Click Count,Q124_1,Q125_1,Q126_1,Q127,Q128,Q129,Q130,Q131,Q204_First Click,Q204_Last Click,Q204_Page Submit,Q204_Click Count,Q205_1,Q206_1,Q207_1,Q208,Q209,Q210,Q211,Q212,Q285_First Click,Q285_Last Click,Q285_Page Submit,Q285_Click Count,Q286_1,Q287_1,Q288_1,Q289,Q290,Q291,Q292,Q293,Q366_First Click,Q366_Last Click,Q366_Page Submit,Q366_Click Count,Q367_1,Q368_1,Q369_1,Q370,Q371,Q372,Q373,Q374,Q69_First Click,Q69_Last Click,Q69_Page Submit,Q69_Click Count,Q70_1,Q71_1,Q72_1,Q73,Q74,Q75,Q76,Q77,Q150_First Click,Q150_Last Click,Q150_Page Submit,Q150_Click Count,Q151_1,Q152_1,Q153_1,Q154,Q155,Q156,Q157,Q158,Q231_First Click,Q231_Last Click,Q231_Page Submit,Q231_Click Count,Q232_1,Q233_1,Q234_1,Q235,Q236,Q237,Q238,Q239,Q312_First Click,Q312_Last Click,Q312_Page Submit,Q312_Click Count,Q313_1,Q314_1,Q315_1,Q316,Q317,Q318,Q319,Q320,Q393_First Click,Q393_Last Click,Q393_Page Submit,Q393_Click Count,Q394_1,Q395_1,Q396_1,Q397,Q398,Q399,Q400,Q401,Q96_First Click,Q96_Last Click,Q96_Page Submit,Q96_Click Count,Q97_1,Q98_1,Q99_1,Q100,Q101,Q102,Q103,Q104,Q177_First Click,Q177_Last Click,Q177_Page Submit,Q177_Click Count,Q178_1,Q179_1,Q180_1,Q181,Q182,Q183,Q184,Q185,Q258_First Click,Q258_Last Click,Q258_Page Submit,Q258_Click Count,Q259_1,Q260_1,Q261_1,Q262,Q263,Q264,Q265,Q266,Q339_First Click,Q339_Last Click,Q339_Page Submit,Q339_Click Count,Q340_1,Q341_1,Q342_1,Q343,Q344,Q345,Q346,Q347,Q420_First Click,Q420_Last Click,Q420_Page Submit,Q420_Click Count,Q421_1,Q422_1,Q423_1,Q424,Q425,Q426,Q427,Q428
Start Date,End Date,Response Type,IP Address,Progress,Duration (in seconds),Finished,Recorded Date,Response ID,Recipient Last Name,Recipient First Name,Recipient Email,External Data Reference,Location Latitude,Location Longitude,Distribution Channel,User Language,"INFORMED CONSENT



Name of principal investigator/researcher: Kevin Allain





Title of study: Evaluating Condition Encodings in Time-Space-Attribute Visualization of Moving Entities





Informed Consent:

 I confirm that I have read and understood the participant information for the study described above. I understand what is required of me and what will be done with the information I provide. 
 I understand that my participation is voluntary and that I am free to withdraw without giving a reason without being penalized or disadvantaged. 
 I understand that the survey will be anonymous and once the survey has been completed the data that I have submitted can no longer be withdrawn. 
 I understand that data collected from partially completed surveys will not be retained. 
 I agree to City recording and processing this information about me. I understand that this information will be used only for the purpose(s) explained in the participant information and my consent is conditional on City complying with its duties and obligations under the General Data Protection Regulation (GDPR).","If you have a Prolific ID then please enter it here.



If you don't know what a Prolific ID is, or don't have one then leave this blank and continue.",In which direction does the car move?,When is the heating on?,Which of these times is closest to the time at which the engine temperature reaches its minimum?,Where is the minimum value of the engine temperature reached?,When is the gps on?,Timing - First Click,Timing - Last Click,Timing - Page Submit,Timing - Click Count,What is the average value of the electricity consumption while the wiper is  on? - Average value,What is the average value of the electricity consumption over the whole time displayed? - Average value,For what percentage of the time displayed is the wiper is  on? - Percentage,The electricity consumption is on average more stable while the wiper is  on than at other times.,Rate your level of confidence in your answer,Rate your level of confidence in your answer,Rate your level of confidence in your answer,Rate your level of confidence in your answer,Timing - First Click,Timing - Last Click,Timing - Page Submit,Timing - Click Count,What is the average value of the electricity consumption while the gps is  on? - Average value,What is the average value of the electricity consumption over the whole time displayed? - Average value,For what percentage of the time displayed is the gps is  on? - Percentage,The electricity consumption is on average more stable while the gps is  on than at other times.,Rate your level of confidence in your answer,Rate your level of confidence in your answer,Rate your level of confidence in your answer,Rate your level of confidence in your answer,Timing - First Click,Timing - Last Click,Timing - Page Submit,Timing - Click Count,What is the average value of the electricity consumption while the car is on a paved road? - Average value,What is the average value of the electricity consumption over the whole time displayed? - Average value,For what percentage of the time displayed is the car is on a paved road? - Percentage,The electricity consumption is on average more stable while the car is on a paved road than at other times.,Rate your level of confidence in your answer,Rate your level of confidence in your answer,Rate your level of confidence in your answer,Rate your level of confidence in your answer,Timing - First Click,Timing - Last Click,Timing - Page Submit,Timing - Click Count,What is the average value of the suspension force while the wiper is  on? - Average value,What is the average value of the suspension force over the whole time displayed? - Average value,For what percentage of the time displayed is the wiper is  on? - Percentage,The suspension force is on average more stable while the wiper is  on than at other times.,Rate your level of confidence in your answer,Rate your level of confidence in your answer,Rate your level of confidence in your answer,Rate your level of confidence in your answer,Timing - First Click,Timing - Last Click,Timing - Page Submit,Timing - Click Count,What is the average value of the engine temperature while the Fuel consumption is greater than 45? - Average value,What is the average value of the engine temperature over the whole time displayed? - Average value,For what percentage of the time displayed is the Fuel consumption is greater than 45? - Percentage,The engine temperature is on average more stable while the Fuel consumption is greater than 45 than at other times.,Rate your level of confidence in your answer,Rate your level of confidence in your answer,Rate your level of confidence in your answer,Rate your level of confidence in your answer,Timing - First Click,Timing - Last Click,Timing - Page Submit,Timing - Click Count,What is the average value of the electricity consumption while the wiper is  on? - Average value,What is the average value of the electricity consumption over the whole time displayed? - Average value,For what percentage of the time displayed is the wiper is  on? - Percentage,The electricity consumption is on average more stable while the wiper is  on than at other times.,Rate your level of confidence in your answer,Rate your level of confidence in your answer,Rate your level of confidence in your answer,Rate your level of confidence in your answer,Timing - First Click,Timing - Last Click,Timing - Page Submit,Timing - Click Count,What is the average value of the suspension force while the wiper is  on? - Average value,What is the average value of the suspension force over the whole time displayed? - Average value,For what percentage of the time displayed is the wiper is  on? - Percentage,The suspension force is on average more stable while the wiper is  on than at other times.,Rate your level of confidence in your answer,Rate your level of confidence in your answer,Rate your level of confidence in your answer,Rate your level of confidence in your answer,Timing - First Click,Timing - Last Click,Timing - Page Submit,Timing - Click Count,What is the average value of the engine temperature while the Fuel consumption is greater than 32? - Average value,What is the average value of the engine temperature over the whole time displayed? - Average value,For what percentage of the time displayed is the Fuel consumption is greater than 32? - Percentage,The engine temperature is on average more stable while the Fuel consumption is greater than 32 than at other times.,Rate your level of confidence in your answer,Rate your level of confidence in your answer,Rate your level of confidence in your answer,Rate your level of confidence in your answer,Timing - First Click,Timing - Last Click,Timing - Page Submit,Timing - Click Count,What is the average value of the electricity consumption while the wiper is  on? - Average value,What is the average value of the electricity consumption over the whole time displayed? - Average value,For what percentage of the time displayed is the wiper is  on? - Percentage,The electricity consumption is on average more stable while the wiper is  on than at other times.,Rate your level of confidence in your answer,Rate your level of confidence in your answer,Rate your level of confidence in your answer,Rate your level of confidence in your answer,Timing - First Click,Timing - Last Click,Timing - Page Submit,Timing - Click Count,What is the average value of the electricity consumption while the Suspension force is greater than 49? - Average value,What is the average value of the electricity consumption over the whole time displayed? - Average value,For what percentage of the time displayed is the Suspension force is greater than 49? - Percentage,The electricity consumption is on average more stable while the Suspension force is greater than 49 than at other times.,Rate your level of confidence in your answer,Rate your level of confidence in your answer,Rate your level of confidence in your answer,Rate your level of confidence in your answer,Timing - First Click,Timing - Last Click,Timing - Page Submit,Timing - Click Count,What is the average value of the engine temperature while the wiper is  on? - Average value,What is the average value of the engine temperature over the whole time displayed? - Average value,For what percentage of the time displayed is the wiper is  on? - Percentage,The engine temperature is on average more stable while the wiper is  on than at other times.,Rate your level of confidence in your answer,Rate your level of confidence in your answer,Rate your level of confidence in your answer,Rate your level of confidence in your answer,Timing - First Click,Timing - Last Click,Timing - Page Submit,Timing - Click Count,What is the average value of the electricity consumption while the wiper is  on? - Average value,What is the average value of the electricity consumption over the whole time displayed? - Average value,For what percentage of the time displayed is the wiper is  on? - Percentage,The electricity consumption is on average more stable while the wiper is  on than at other times.,Rate your level of confidence in your answer,Rate your level of confidence in your answer,Rate your level of confidence in your answer,Rate your level of confidence in your answer,Timing - First Click,Timing - Last Click,Timing - Page Submit,Timing - Click Count,What is the average value of the electricity consumption while the gps is  on? - Average value,What is the average value of the electricity consumption over the whole time displayed? - Average value,For what percentage of the time displayed is the gps is  on? - Percentage,The electricity consumption is on average more stable while the gps is  on than at other times.,Rate your level of confidence in your answer,Rate your level of confidence in your answer,Rate your level of confidence in your answer,Rate your level of confidence in your answer,Timing - First Click,Timing - Last Click,Timing - Page Submit,Timing - Click Count,What is the average value of the electricity consumption while the wiper is  on? - Average value,What is the average value of the electricity consumption over the whole time displayed? - Average value,For what percentage of the time displayed is the wiper is  on? - Percentage,The electricity consumption is on average more stable while the wiper is  on than at other times.,Rate your level of confidence in your answer,Rate your level of confidence in your answer,Rate your level of confidence in your answer,Rate your level of confidence in your answer,Timing - First Click,Timing - Last Click,Timing - Page Submit,Timing - Click Count,What is the average value of the suspension force while the Fuel consumption is greater than 86? - Average value,What is the average value of the suspension force over the whole time displayed? - Average value,For what percentage of the time displayed is the Fuel consumption is greater than 86? - Percentage,The suspension force is on average more stable while the Fuel consumption is greater than 86 than at other times.,Rate your level of confidence in your answer,Rate your level of confidence in your answer,Rate your level of confidence in your answer,Rate your level of confidence in your answer,Timing - First Click,Timing - Last Click,Timing - Page Submit,Timing - Click Count,For how long are both the radio  on and the Fuel consumption greater than 18? - Time,For how long is the radio  on? - Time,For what percentage of the time displayed is the Fuel consumption greater than 18? - Percentage,The radio switches less frequently while the Fuel consumption is greater than 18 than at other times.,Rate your level of confidence in your answer,Rate your level of confidence in your answer,Rate your level of confidence in your answer,Rate your level of confidence in your answer,Timing - First Click,Timing - Last Click,Timing - Page Submit,Timing - Click Count,For how long are both the gps  on and the car on a paved road? - Time,For how long is the gps  on? - Time,For what percentage of the time displayed is the car on a paved road? - Percentage,The gps switches less frequently while the car is on a paved road than at other times.,Rate your level of confidence in your answer,Rate your level of confidence in your answer,Rate your level of confidence in your answer,Rate your level of confidence in your answer,Timing - First Click,Timing - Last Click,Timing - Page Submit,Timing - Click Count,For how long are both the wiper  on and the gps  on? - Time,For how long is the wiper  on? - Time,For what percentage of the time displayed is the gps  on? - Percentage,The wiper switches less frequently while the gps is  on than at other times.,Rate your level of confidence in your answer,Rate your level of confidence in your answer,Rate your level of confidence in your answer,Rate your level of confidence in your answer,Timing - First Click,Timing - Last Click,Timing - Page Submit,Timing - Click Count,For how long are both the radio  on and the wiper  on? - Time,For how long is the radio  on? - Time,For what percentage of the time displayed is the wiper  on? - Percentage,The radio switches less frequently while the wiper is  on than at other times.,Rate your level of confidence in your answer,Rate your level of confidence in your answer,Rate your level of confidence in your answer,Rate your level of confidence in your answer,Timing - First Click,Timing - Last Click,Timing - Page Submit,Timing - Click Count,For how long are both the gps  on and the wiper  on? - Time,For how long is the gps  on? - Time,For what percentage of the time displayed is the wiper  on? - Percentage,The gps switches less frequently while the wiper is  on than at other times.,Rate your level of confidence in your answer,Rate your level of confidence in your answer,Rate your level of confidence in your answer,Rate your level of confidence in your answer,Timing - First Click,Timing - Last Click,Timing - Page Submit,Timing - Click Count,For how long are both the wiper  on and the gps  on? - Time,For how long is the wiper  on? - Time,For what percentage of the time displayed is the gps  on? - Percentage,The wiper switches less frequently while the gps is  on than at other times.,Rate your level of confidence in your answer,Rate your level of confidence in your answer,Rate your level of confidence in your answer,Rate your level of confidence in your answer,Timing - First Click,Timing - Last Click,Timing - Page Submit,Timing - Click Count,For how long are both the radio  on and the car on a paved road? - Time,For how long is the radio  on? - Time,For what percentage of the time displayed is the car on a paved road? - Percentage,The radio switches less frequently while the car is on a paved road than at other times.,Rate your level of confidence in your answer,Rate your level of confidence in your answer,Rate your level of confidence in your answer,Rate your level of confidence in your answer,Timing - First Click,Timing - Last Click,Timing - Page Submit,Timing - Click Count,For how long are both the gps  on and the wiper  on? - Time,For how long is the gps  on? - Time,For what percentage of the time displayed is the wiper  on? - Percentage,The gps switches less frequently while the wiper is  on than at other times.,Rate your level of confidence in your answer,Rate your level of confidence in your answer,Rate your level of confidence in your answer,Rate your level of confidence in your answer,Timing - First Click,Timing - Last Click,Timing - Page Submit,Timing - Click Count,For how long are both the radio  on and the Fuel consumption greater than 30? - Time,For how long is the radio  on? - Time,For what percentage of the time displayed is the Fuel consumption greater than 30? - Percentage,The radio switches less frequently while the Fuel consumption is greater than 30 than at other times.,Rate your level of confidence in your answer,Rate your level of confidence in your answer,Rate your level of confidence in your answer,Rate your level of confidence in your answer,Timing - First Click,Timing - Last Click,Timing - Page Submit,Timing - Click Count,For how long are both the gps  on and the wiper  on? - Time,For how long is the gps  on? - Time,For what percentage of the time displayed is the wiper  on? - Percentage,The gps switches less frequently while the wiper is  on than at other times.,Rate your level of confidence in your answer,Rate your level of confidence in your answer,Rate your level of confidence in your answer,Rate your level of confidence in your answer,Timing - First Click,Timing - Last Click,Timing - Page Submit,Timing - Click Count,For how long are both the gps  on and the wiper  on? - Time,For how long is the gps  on? - Time,For what percentage of the time displayed is the wiper  on? - Percentage,The gps switches less frequently while the wiper is  on than at other times.,Rate your level of confidence in your answer,Rate your level of confidence in your answer,Rate your level of confidence in your answer,Rate your level of confidence in your answer,Timing - First Click,Timing - Last Click,Timing - Page Submit,Timing - Click Count,For how long are both the radio  on and the wiper  on? - Time,For how long is the radio  on? - Time,For what percentage of the time displayed is the wiper  on? - Percentage,The radio switches less frequently while the wiper is  on than at other times.,Rate your level of confidence in your answer,Rate your level of confidence in your answer,Rate your level of confidence in your answer,Rate your level of confidence in your answer,Timing - First Click,Timing - Last Click,Timing - Page Submit,Timing - Click Count,For how long are both the gps  on and the wiper  on? - Time,For how long is the gps  on? - Time,For what percentage of the time displayed is the wiper  on? - Percentage,The gps switches less frequently while the wiper is  on than at other times.,Rate your level of confidence in your answer,Rate your level of confidence in your answer,Rate your level of confidence in your answer,Rate your level of confidence in your answer,Timing - First Click,Timing - Last Click,Timing - Page Submit,Timing - Click Count,For how long are both the wiper  on and the Suspension force greater than 81? - Time,For how long is the wiper  on? - Time,For what percentage of the time displayed is the Suspension force greater than 81? - Percentage,The wiper switches less frequently while the Suspension force is greater than 81 than at other times.,Rate your level of confidence in your answer,Rate your level of confidence in your answer,Rate your level of confidence in your answer,Rate your level of confidence in your answer,Timing - First Click,Timing - Last Click,Timing - Page Submit,Timing - Click Count,For how long are both the radio  on and the wiper  on? - Time,For how long is the radio  on? - Time,For what percentage of the time displayed is the wiper  on? - Percentage,The radio switches less frequently while the wiper is  on than at other times.,Rate your level of confidence in your answer,Rate your level of confidence in your answer,Rate your level of confidence in your answer,Rate your level of confidence in your answer,Timing - First Click,Timing - Last Click,Timing - Page Submit,Timing - Click Count,What is the average distance between the trajectory and the point of interest while the wiper is  on? - Average distance,What is the average distance between the trajectory and the point of interest? - Average distance,For what percentage of the time displayed is the wiper is  on? - Percentage,The distance between the trajectory and the point of interest is more stable while the wiper is  on than at other times.,Rate your level of confidence in your answer,Rate your level of confidence in your answer,Rate your level of confidence in your answer,Rate your level of confidence in your answer,Timing - First Click,Timing - Last Click,Timing - Page Submit,Timing - Click Count,What is the average distance between the trajectory and the point of interest while the car is on a paved road? - Average distance,What is the average distance between the trajectory and the point of interest? - Average distance,For what percentage of the time displayed is the car is on a paved road? - Percentage,The distance between the trajectory and the point of interest is more stable while the car is on a paved road than at other times.,Rate your level of confidence in your answer,Rate your level of confidence in your answer,Rate your level of confidence in your answer,Rate your level of confidence in your answer,Timing - First Click,Timing - Last Click,Timing - Page Submit,Timing - Click Count,What is the average distance between the trajectory and the point of interest while the wiper is  on? - Average distance,What is the average distance between the trajectory and the point of interest? - Average distance,For what percentage of the time displayed is the wiper is  on? - Percentage,The distance between the trajectory and the point of interest is more stable while the wiper is  on than at other times.,Rate your level of confidence in your answer,Rate your level of confidence in your answer,Rate your level of confidence in your answer,Rate your level of confidence in your answer,Timing - First Click,Timing - Last Click,Timing - Page Submit,Timing - Click Count,What is the average distance between the trajectory and the point of interest while the Suspension force is greater than 39? - Average distance,What is the average distance between the trajectory and the point of interest? - Average distance,For what percentage of the time displayed is the Suspension force is greater than 39? - Percentage,The distance between the trajectory and the point of interest is more stable while the Suspension force is greater than 39 than at other times.,Rate your level of confidence in your answer,Rate your level of confidence in your answer,Rate your level of confidence in your answer,Rate your level of confidence in your answer,Timing - First Click,Timing - Last Click,Timing - Page Submit,Timing - Click Count,What is the average distance between the trajectory and the point of interest while the wiper is  on? - Average distance,What is the average distance between the trajectory and the point of interest? - Average distance,For what percentage of the time displayed is the wiper is  on? - Percentage,The distance between the trajectory and the point of interest is more stable while the wiper is  on than at other times.,Rate your level of confidence in your answer,Rate your level of confidence in your answer,Rate your level of confidence in your answer,Rate your level of confidence in your answer,Timing - First Click,Timing - Last Click,Timing - Page Submit,Timing - Click Count,What is the average distance between the trajectory and the point of interest while the Suspension force is greater than 19? - Average distance,What is the average distance between the trajectory and the point of interest? - Average distance,For what percentage of the time displayed is the Suspension force is greater than 19? - Percentage,The distance between the trajectory and the point of interest is more stable while the Suspension force is greater than 19 than at other times.,Rate your level of confidence in your answer,Rate your level of confidence in your answer,Rate your level of confidence in your answer,Rate your level of confidence in your answer,Timing - First Click,Timing - Last Click,Timing - Page Submit,Timing - Click Count,What is the average distance between the trajectory and the point of interest while the Suspension force is greater than 65? - Average distance,What is the average distance between the trajectory and the point of interest? - Average distance,For what percentage of the time displayed is the Suspension force is greater than 65? - Percentage,The distance between the trajectory and the point of interest is more stable while the Suspension force is greater than 65 than at other times.,Rate your level of confidence in your answer,Rate your level of confidence in your answer,Rate your level of confidence in your answer,Rate your level of confidence in your answer,Timing - First Click,Timing - Last Click,Timing - Page Submit,Timing - Click Count,What is the average distance between the trajectory and the point of interest while the car is on a paved road? - Average distance,What is the average distance between the trajectory and the point of interest? - Average distance,For what percentage of the time displayed is the car is on a paved road? - Percentage,The distance between the trajectory and the point of interest is more stable while the car is on a paved road than at other times.,Rate your level of confidence in your answer,Rate your level of confidence in your answer,Rate your level of confidence in your answer,Rate your level of confidence in your answer,Timing - First Click,Timing - Last Click,Timing - Page Submit,Timing - Click Count,What is the average distance between the trajectory and the point of interest while the Fuel consumption is greater than 9? - Average distance,What is the average distance between the trajectory and the point of interest? - Average distance,For what percentage of the time displayed is the Fuel consumption is greater than 9? - Percentage,The distance between the trajectory and the point of interest is more stable while the Fuel consumption is greater than 9 than at other times.,Rate your level of confidence in your answer,Rate your level of confidence in your answer,Rate your level of confidence in your answer,Rate your level of confidence in your answer,Timing - First Click,Timing - Last Click,Timing - Page Submit,Timing - Click Count,What is the average distance between the trajectory and the point of interest while the wiper is  on? - Average distance,What is the average distance between the trajectory and the point of interest? - Average distance,For what percentage of the time displayed is the wiper is  on? - Percentage,The distance between the trajectory and the point of interest is more stable while the wiper is  on than at other times.,Rate your level of confidence in your answer,Rate your level of confidence in your answer,Rate your level of confidence in your answer,Rate your level of confidence in your answer,Timing - First Click,Timing - Last Click,Timing - Page Submit,Timing - Click Count,What is the average distance between the trajectory and the point of interest while the wiper is  on? - Average distance,What is the average distance between the trajectory and the point of interest? - Average distance,For what percentage of the time displayed is the wiper is  on? - Percentage,The distance between the trajectory and the point of interest is more stable while the wiper is  on than at other times.,Rate your level of confidence in your answer,Rate your level of confidence in your answer,Rate your level of confidence in your answer,Rate your level of confidence in your answer,Timing - First Click,Timing - Last Click,Timing - Page Submit,Timing - Click Count,What is the average distance between the trajectory and the point of interest while the car is on a paved road? - Average distance,What is the average distance between the trajectory and the point of interest? - Average distance,For what percentage of the time displayed is the car is on a paved road? - Percentage,The distance between the trajectory and the point of interest is more stable while the car is on a paved road than at other times.,Rate your level of confidence in your answer,Rate your level of confidence in your answer,Rate your level of confidence in your answer,Rate your level of confidence in your answer,Timing - First Click,Timing - Last Click,Timing - Page Submit,Timing - Click Count,What is the average distance between the trajectory and the point of interest while the wiper is  on? - Average distance,What is the average distance between the trajectory and the point of interest? - Average distance,For what percentage of the time displayed is the wiper is  on? - Percentage,The distance between the trajectory and the point of interest is more stable while the wiper is  on than at other times.,Rate your level of confidence in your answer,Rate your level of confidence in your answer,Rate your level of confidence in your answer,Rate your level of confidence in your answer,Timing - First Click,Timing - Last Click,Timing - Page Submit,Timing - Click Count,What is the average distance between the trajectory and the point of interest while the wiper is  on? - Average distance,What is the average distance between the trajectory and the point of interest? - Average distance,For what percentage of the time displayed is the wiper is  on? - Percentage,The distance between the trajectory and the point of interest is more stable while the wiper is  on than at other times.,Rate your level of confidence in your answer,Rate your level of confidence in your answer,Rate your level of confidence in your answer,Rate your level of confidence in your answer,Timing - First Click,Timing - Last Click,Timing - Page Submit,Timing - Click Count,What is the average distance between the trajectory and the point of interest while the car is on a paved road? - Average distance,What is the average distance between the trajectory and the point of interest? - Average distance,For what percentage of the time displayed is the car is on a paved road? - Percentage,The distance between the trajectory and the point of interest is more stable while the car is on a paved road than at other times.,Rate your level of confidence in your answer,Rate your level of confidence in your answer,Rate your level of confidence in your answer,Rate your level of confidence in your answer
